{
  "$schema": "../../../schema/component-seed.schema.json",
  "seedVersion": 1,
  "id": "cmp_iconchip",
  "slug": "icon-chip",
  "kind": "element",
  "categorySlug": "elements",
  "meta": {
    "name": "IconChip",
    "displayName": {
      "id": "Chip Ikon",
      "en": "Icon Chip"
    },
    "description": {
      "id": "Chip kecil berisi ikon + label untuk fitur/keunggulan.",
      "en": "Small chip with icon + label for a feature/benefit."
    },
    "tags": [
      "chip",
      "feature"
    ],
    "keywords": {
      "id": [
        "fitur",
        "keunggulan"
      ],
      "en": [
        "feature",
        "benefit"
      ]
    },
    "aiHints": "Highlight satu keunggulan singkat; ikon Lucide relevan + 1–3 kata."
  },
  "versions": [
    {
      "version": "1.0.0",
      "status": "published",
      "changelog": {
        "id": "Rilis awal.",
        "en": "Initial release."
      },
      "definition": {
        "subtree": {
          "rootIds": [
            "tmp_iconch0"
          ],
          "nodes": {
            "tmp_iconch0": {
              "id": "tmp_iconch0",
              "type": "frame",
              "name": "Chip",
              "parentId": "tmp_parent",
              "visible": true,
              "locked": false,
              "children": [
                "tmp_iconch1",
                "tmp_iconch2"
              ],
              "props": {
                "role": "generic"
              },
              "style": {
                "base": {
                  "layout": {
                    "mode": "flex",
                    "direction": "row",
                    "align": "center",
                    "gap": {
                      "$token": "space.2"
                    },
                    "padding": {
                      "top": {
                        "$token": "space.2"
                      },
                      "right": {
                        "$token": "space.4"
                      },
                      "bottom": {
                        "$token": "space.2"
                      },
                      "left": {
                        "$token": "space.4"
                      }
                    }
                  },
                  "size": {
                    "width": {
                      "mode": "hug"
                    },
                    "height": {
                      "mode": "hug"
                    }
                  },
                  "radius": {
                    "$token": "radius.full"
                  },
                  "fills": [
                    {
                      "type": "solid",
                      "color": {
                        "$token": "color.surface"
                      }
                    }
                  ]
                }
              }
            },
            "tmp_iconch1": {
              "id": "tmp_iconch1",
              "type": "icon",
              "name": "ChipIcon",
              "parentId": "tmp_iconch0",
              "visible": true,
              "locked": false,
              "props": {
                "set": "lucide",
                "name": "check"
              },
              "style": {
                "base": {
                  "size": {
                    "width": {
                      "mode": "fixed",
                      "value": 18,
                      "unit": "px"
                    },
                    "height": {
                      "mode": "fixed",
                      "value": 18,
                      "unit": "px"
                    }
                  },
                  "color": {
                    "$token": "color.primary"
                  }
                }
              }
            },
            "tmp_iconch2": {
              "id": "tmp_iconch2",
              "type": "text",
              "name": "Label",
              "parentId": "tmp_iconch0",
              "visible": true,
              "locked": false,
              "tag": "span",
              "props": {
                "content": {
                  "type": "doc",
                  "content": [
                    {
                      "type": "paragraph",
                      "content": [
                        {
                          "type": "text",
                          "text": "Gratis Ongkir"
                        }
                      ]
                    }
                  ]
                }
              },
              "style": {
                "base": {
                  "size": {
                    "width": {
                      "mode": "hug"
                    },
                    "height": {
                      "mode": "hug"
                    }
                  },
                  "typography": {
                    "$token": "typography.bodySm"
                  },
                  "color": {
                    "$token": "color.onSurface"
                  }
                }
              }
            }
          }
        }
      }
    }
  ]
}
