{
  "$schema": "../../../schema/component-seed.schema.json",
  "seedVersion": 1,
  "id": "cmp_contenttwocolumntext",
  "slug": "content-two-column-text",
  "kind": "section",
  "categorySlug": "content",
  "meta": {
    "name": "TwoColumnText",
    "displayName": {
      "id": "Teks Dua Kolom",
      "en": "Two-column Text"
    },
    "description": {
      "id": "Dua kolom paragraf berdampingan untuk konten panjang.",
      "en": "Two side-by-side paragraph columns for longer content."
    },
    "tags": ["content", "text"],
    "keywords": {
      "id": ["konten", "teks", "galeri"],
      "en": ["content", "text", "gallery"]
    },
    "aiHints": "Blok konten informatif. Jaga keterbacaan: paragraf pendek, heading jelas."
  },
  "versions": [
    {
      "version": "1.0.0",
      "status": "published",
      "changelog": {
        "id": "Rilis awal.",
        "en": "Initial release."
      },
      "definition": {
        "subtree": {
          "rootIds": ["tmp_conten0"],
          "nodes": {
            "tmp_conten0": {
              "id": "tmp_conten0",
              "type": "frame",
              "name": "TwoColumnText",
              "parentId": "tmp_parent",
              "visible": true,
              "locked": false,
              "children": ["tmp_conten1"],
              "tag": "section",
              "props": {
                "role": "section"
              },
              "style": {
                "base": {
                  "layout": {
                    "mode": "flex",
                    "direction": "column",
                    "align": "center",
                    "padding": {
                      "top": {
                        "$token": "space.18"
                      },
                      "right": {
                        "$token": "space.6"
                      },
                      "bottom": {
                        "$token": "space.18"
                      },
                      "left": {
                        "$token": "space.6"
                      }
                    }
                  },
                  "size": {
                    "width": {
                      "mode": "fill"
                    },
                    "height": {
                      "mode": "hug"
                    }
                  }
                }
              }
            },
            "tmp_conten1": {
              "id": "tmp_conten1",
              "type": "frame",
              "name": "Container",
              "parentId": "tmp_conten0",
              "visible": true,
              "locked": false,
              "children": ["tmp_conten2", "tmp_conten4"],
              "props": {},
              "style": {
                "base": {
                  "layout": {
                    "mode": "flex",
                    "direction": "column",
                    "align": "center",
                    "gap": {
                      "$token": "space.6"
                    }
                  },
                  "size": {
                    "width": {
                      "mode": "fill"
                    },
                    "height": {
                      "mode": "hug"
                    },
                    "maxWidth": {
                      "$token": "size.container"
                    }
                  }
                }
              }
            },
            "tmp_conten2": {
              "id": "tmp_conten2",
              "type": "frame",
              "name": "Heading",
              "parentId": "tmp_conten1",
              "visible": true,
              "locked": false,
              "children": ["tmp_conten3"],
              "props": {},
              "style": {
                "base": {
                  "layout": {
                    "mode": "flex",
                    "direction": "column",
                    "align": "center",
                    "gap": {
                      "$token": "space.3"
                    }
                  },
                  "size": {
                    "width": {
                      "mode": "fill"
                    },
                    "height": {
                      "mode": "hug"
                    },
                    "maxWidth": {
                      "value": 680,
                      "unit": "px"
                    }
                  }
                }
              }
            },
            "tmp_conten3": {
              "id": "tmp_conten3",
              "type": "text",
              "name": "Title",
              "parentId": "tmp_conten2",
              "visible": true,
              "locked": false,
              "tag": "h2",
              "props": {
                "content": {
                  "type": "doc",
                  "content": [
                    {
                      "type": "paragraph",
                      "content": [
                        {
                          "type": "text",
                          "text": "Cerita kami"
                        }
                      ]
                    }
                  ]
                }
              },
              "style": {
                "base": {
                  "size": {
                    "width": {
                      "mode": "fill"
                    },
                    "height": {
                      "mode": "hug"
                    }
                  },
                  "typography": {
                    "$token": "typography.h2"
                  },
                  "color": {
                    "$token": "color.onSurface"
                  }
                }
              }
            },
            "tmp_conten4": {
              "id": "tmp_conten4",
              "type": "frame",
              "name": "Columns",
              "parentId": "tmp_conten1",
              "visible": true,
              "locked": false,
              "children": ["tmp_conten5", "tmp_conten6"],
              "props": {},
              "style": {
                "base": {
                  "layout": {
                    "mode": "flex",
                    "direction": "row",
                    "align": "start",
                    "gap": {
                      "$token": "space.8"
                    },
                    "wrap": true
                  },
                  "size": {
                    "width": {
                      "mode": "fill"
                    },
                    "height": {
                      "mode": "hug"
                    }
                  }
                }
              }
            },
            "tmp_conten5": {
              "id": "tmp_conten5",
              "type": "text",
              "name": "Paragraph",
              "parentId": "tmp_conten4",
              "visible": true,
              "locked": false,
              "tag": "p",
              "props": {
                "content": {
                  "type": "doc",
                  "content": [
                    {
                      "type": "paragraph",
                      "content": [
                        {
                          "type": "text",
                          "text": "Kami membantu bisnis kecil dan menengah tampil profesional di dunia digital. Dengan alat yang mudah dan desain siap pakai, Anda bisa fokus pada yang terpenting: melayani pelanggan."
                        }
                      ]
                    }
                  ]
                }
              },
              "style": {
                "base": {
                  "size": {
                    "width": {
                      "mode": "fill"
                    },
                    "height": {
                      "mode": "hug"
                    }
                  },
                  "typography": {
                    "$token": "typography.body"
                  },
                  "color": {
                    "$token": "color.onSurface"
                  }
                }
              }
            },
            "tmp_conten6": {
              "id": "tmp_conten6",
              "type": "text",
              "name": "Paragraph",
              "parentId": "tmp_conten4",
              "visible": true,
              "locked": false,
              "tag": "p",
              "props": {
                "content": {
                  "type": "doc",
                  "content": [
                    {
                      "type": "paragraph",
                      "content": [
                        {
                          "type": "text",
                          "text": "Berawal dari satu kedai kecil, kini kami melayani pelanggan di berbagai kota dengan semangat yang sama."
                        }
                      ]
                    }
                  ]
                }
              },
              "style": {
                "base": {
                  "size": {
                    "width": {
                      "mode": "fill"
                    },
                    "height": {
                      "mode": "hug"
                    }
                  },
                  "typography": {
                    "$token": "typography.body"
                  },
                  "color": {
                    "$token": "color.onSurface"
                  }
                }
              }
            }
          }
        }
      }
    }
  ]
}
