{
  "$schema": "../../../schema/component-seed.schema.json",
  "seedVersion": 1,
  "id": "cmp_buttonghost",
  "slug": "button-ghost",
  "kind": "element",
  "categorySlug": "elements",
  "meta": {
    "name": "ButtonGhost",
    "displayName": {
      "id": "Tombol Ghost",
      "en": "Ghost Button"
    },
    "description": {
      "id": "Tombol tanpa latar untuk aksi ringan (mis. navigasi).",
      "en": "Background-less button for low-emphasis actions."
    },
    "tags": ["button", "ghost"],
    "keywords": {
      "id": ["tombol", "ajakan"],
      "en": ["button", "cta"]
    },
    "aiHints": "Satu aksi per section. Isi label dengan kata kerja singkat; pasang link WhatsApp atau halaman tujuan."
  },
  "versions": [
    {
      "version": "1.0.0",
      "status": "published",
      "changelog": {
        "id": "Rilis awal.",
        "en": "Initial release."
      },
      "definition": {
        "subtree": {
          "rootIds": ["tmp_button0"],
          "nodes": {
            "tmp_button0": {
              "id": "tmp_button0",
              "type": "frame",
              "name": "Button",
              "parentId": "tmp_parent",
              "visible": true,
              "locked": false,
              "children": ["tmp_button1"],
              "props": {
                "role": "button"
              },
              "style": {
                "base": {
                  "layout": {
                    "mode": "flex",
                    "direction": "row",
                    "align": "center",
                    "justify": "center",
                    "gap": {
                      "$token": "space.2"
                    },
                    "padding": {
                      "top": {
                        "$token": "space.3"
                      },
                      "right": {
                        "$token": "space.6"
                      },
                      "bottom": {
                        "$token": "space.3"
                      },
                      "left": {
                        "$token": "space.6"
                      }
                    }
                  },
                  "size": {
                    "width": {
                      "mode": "hug"
                    },
                    "height": {
                      "mode": "hug"
                    }
                  },
                  "radius": {
                    "$token": "radius.md"
                  }
                }
              }
            },
            "tmp_button1": {
              "id": "tmp_button1",
              "type": "text",
              "name": "Label",
              "parentId": "tmp_button0",
              "visible": true,
              "locked": false,
              "tag": "span",
              "props": {
                "content": {
                  "type": "doc",
                  "content": [
                    {
                      "type": "paragraph",
                      "content": [
                        {
                          "type": "text",
                          "text": "Lihat Selengkapnya"
                        }
                      ]
                    }
                  ]
                }
              },
              "style": {
                "base": {
                  "size": {
                    "width": {
                      "mode": "hug"
                    },
                    "height": {
                      "mode": "hug"
                    }
                  },
                  "typography": {
                    "$token": "typography.button"
                  },
                  "color": {
                    "$token": "color.primary"
                  }
                }
              }
            }
          }
        }
      }
    }
  ]
}
