{
  "$schema": "../../../schema/component-seed.schema.json",
  "seedVersion": 1,
  "id": "cmp_inputtext",
  "slug": "input-text",
  "kind": "element",
  "categorySlug": "elements",
  "meta": {
    "name": "InputText",
    "displayName": {
      "id": "Input Teks",
      "en": "Text Input"
    },
    "description": {
      "id": "Kolom isian teks dengan placeholder dan border.",
      "en": "A text input field with a placeholder and border."
    },
    "tags": ["input", "field"],
    "keywords": {
      "id": ["elemen", "dasar", "input"],
      "en": ["element", "input"]
    },
    "aiHints": "Elemen kecil untuk menyusun section. Gabungkan beberapa untuk membentuk blok."
  },
  "versions": [
    {
      "version": "1.0.0",
      "status": "published",
      "changelog": {
        "id": "Rilis awal.",
        "en": "Initial release."
      },
      "definition": {
        "subtree": {
          "rootIds": ["tmp_inputt0"],
          "nodes": {
            "tmp_inputt0": {
              "id": "tmp_inputt0",
              "type": "frame",
              "name": "Input",
              "parentId": "tmp_parent",
              "visible": true,
              "locked": false,
              "children": ["tmp_inputt1"],
              "props": {},
              "style": {
                "base": {
                  "layout": {
                    "mode": "flex",
                    "direction": "row",
                    "align": "center",
                    "justify": "spaceBetween",
                    "gap": {
                      "$token": "space.2"
                    },
                    "padding": {
                      "top": {
                        "$token": "space.3"
                      },
                      "right": {
                        "$token": "space.4"
                      },
                      "bottom": {
                        "$token": "space.3"
                      },
                      "left": {
                        "$token": "space.4"
                      }
                    }
                  },
                  "size": {
                    "width": {
                      "mode": "fill"
                    },
                    "height": {
                      "mode": "hug"
                    }
                  },
                  "fills": [
                    {
                      "type": "solid",
                      "color": {
                        "$token": "color.background"
                      }
                    }
                  ],
                  "radius": {
                    "$token": "radius.md"
                  },
                  "strokes": [
                    {
                      "color": {
                        "$token": "color.border"
                      },
                      "width": {
                        "value": 1,
                        "unit": "px"
                      }
                    }
                  ]
                }
              }
            },
            "tmp_inputt1": {
              "id": "tmp_inputt1",
              "type": "text",
              "name": "Placeholder",
              "parentId": "tmp_inputt0",
              "visible": true,
              "locked": false,
              "tag": "span",
              "props": {
                "content": {
                  "type": "doc",
                  "content": [
                    {
                      "type": "paragraph",
                      "content": [
                        {
                          "type": "text",
                          "text": "Ketik di sini…"
                        }
                      ]
                    }
                  ]
                }
              },
              "style": {
                "base": {
                  "size": {
                    "width": {
                      "mode": "fill"
                    },
                    "height": {
                      "mode": "hug"
                    }
                  },
                  "typography": {
                    "$token": "typography.body"
                  },
                  "color": {
                    "$token": "color.muted"
                  }
                }
              }
            }
          }
        }
      }
    }
  ]
}
