{
  "$schema": "../../../schema/component-seed.schema.json",
  "seedVersion": 1,
  "id": "cmp_badgesolid",
  "slug": "badge-solid",
  "kind": "element",
  "categorySlug": "elements",
  "meta": {
    "name": "BadgeSolid",
    "displayName": {
      "id": "Badge Solid",
      "en": "Solid Badge"
    },
    "description": {
      "id": "Label kecil berlatar primer (mis. \"Baru\", \"Promo\").",
      "en": "Small primary-filled label (e.g. \"New\", \"Sale\")."
    },
    "tags": [
      "badge",
      "label"
    ],
    "keywords": {
      "id": [
        "label",
        "status"
      ],
      "en": [
        "badge",
        "tag"
      ]
    },
    "aiHints": "Penanda status singkat 1–2 kata; jangan untuk kalimat panjang."
  },
  "versions": [
    {
      "version": "1.0.0",
      "status": "published",
      "changelog": {
        "id": "Rilis awal.",
        "en": "Initial release."
      },
      "definition": {
        "subtree": {
          "rootIds": [
            "tmp_badges0"
          ],
          "nodes": {
            "tmp_badges0": {
              "id": "tmp_badges0",
              "type": "frame",
              "name": "Badge",
              "parentId": "tmp_parent",
              "visible": true,
              "locked": false,
              "children": [
                "tmp_badges1"
              ],
              "props": {
                "role": "generic"
              },
              "style": {
                "base": {
                  "layout": {
                    "mode": "flex",
                    "direction": "row",
                    "align": "center",
                    "justify": "center",
                    "padding": {
                      "top": {
                        "$token": "space.1"
                      },
                      "right": {
                        "$token": "space.3"
                      },
                      "bottom": {
                        "$token": "space.1"
                      },
                      "left": {
                        "$token": "space.3"
                      }
                    }
                  },
                  "size": {
                    "width": {
                      "mode": "hug"
                    },
                    "height": {
                      "mode": "hug"
                    }
                  },
                  "radius": {
                    "$token": "radius.full"
                  },
                  "fills": [
                    {
                      "type": "solid",
                      "color": {
                        "$token": "color.primary"
                      }
                    }
                  ]
                }
              }
            },
            "tmp_badges1": {
              "id": "tmp_badges1",
              "type": "text",
              "name": "Label",
              "parentId": "tmp_badges0",
              "visible": true,
              "locked": false,
              "tag": "span",
              "props": {
                "content": {
                  "type": "doc",
                  "content": [
                    {
                      "type": "paragraph",
                      "content": [
                        {
                          "type": "text",
                          "text": "Baru"
                        }
                      ]
                    }
                  ]
                }
              },
              "style": {
                "base": {
                  "size": {
                    "width": {
                      "mode": "hug"
                    },
                    "height": {
                      "mode": "hug"
                    }
                  },
                  "typography": {
                    "$token": "typography.caption"
                  },
                  "color": {
                    "$token": "color.onPrimary"
                  }
                }
              }
            }
          }
        }
      }
    }
  ]
}
